{
  "schemaVersion": "1.0.0",
  "decisionCaseId": "case-2001",
  "evaluationRunId": "30000000-0000-4000-8000-000000002001",
  "agentRunId": "60000000-0000-4000-8000-000000002001",
  "attemptId": 1,
  "requestIdempotencyKey": "loan-agent-case-2001-v1",
  "result": {
    "schemaVersion": "1.0.0",
    "resultStatus": "COMPLETED",
    "agentRun": {
      "schemaVersion": "1.0.0",
      "decisionCaseId": "case-2001",
      "evaluationRunId": "30000000-0000-4000-8000-000000002001",
      "agentRunId": "60000000-0000-4000-8000-000000002001",
      "attemptId": 1,
      "agentType": "LOAN_DECISION_AGENT",
      "requestIdempotencyKey": "loan-agent-case-2001-v1",
      "startedAt": "2026-07-21T10:10:00+09:00",
      "completedAt": "2026-07-21T10:10:03+09:00",
      "runtimeVersion": "agent-runtime.v1.0.0"
    },
    "snapshotReference": {
      "schemaVersion": "1.0.0",
      "snapshotId": "snapshot-2001",
      "snapshotVersion": "v1",
      "snapshotSchemaVersion": "1.0.0",
      "snapshotCreatedAt": "2026-07-21T10:00:00+09:00",
      "digestAlgorithm": "sha256",
      "snapshotDigest": "sha256:aaaaaaaaaaaaaaaaaaaaaaaaaaaaaaaaaaaaaaaaaaaaaaaaaaaaaaaaaaaaaaaa",
      "snapshotReference": "snapshot://loan-2001/v1",
      "referenceType": "IMMUTABLE_REFERENCE"
    },
    "featureSchemaVersion": "phase-2-loan-features.v1.0.0",
    "preprocessingVersion": "preprocess.v1.0.0",
    "modelVersion": "loan-model.v1.0.0",
    "modelArtifactDigest": "sha256:eeeeeeeeeeeeeeeeeeeeeeeeeeeeeeeeeeeeeeeeeeeeeeeeeeeeeeeeeeeeeeee",
    "thresholdVersion": "threshold.v1.0.0",
    "proposal": {
      "schemaVersion": "1.0.0",
      "proposalId": "70000000-0000-4000-8000-000000002001",
      "proposalOutcome": "RECOMMEND_APPROVAL",
      "repaymentLikelihoodScore": 0.86,
      "scoreSemantics": "higher score means higher repayment likelihood",
      "threshold": 0.72,
      "thresholdVersion": "threshold.v1.0.0",
      "comparisonDirection": "score_greater_than_or_equal_threshold_supports_approval",
      "reasonCodes": ["LOW_DTI", "STABLE_INCOME"],
      "modelVersion": "loan-model.v1.0.0",
      "featureSchemaVersion": "phase-2-loan-features.v1.0.0",
      "generatedAt": "2026-07-21T10:10:03+09:00"
    },
    "explanationRef": "shap://loan-2001/agent-run-2001/attempt-1",
    "explanationDigest": "sha256:2222222222222222222222222222222222222222222222222222222222222222",
    "evidenceRefs": ["snapshot://loan-2001/v1"],
    "completedAt": "2026-07-21T10:10:03+09:00"
  }
}
